,Title,Date
0,Creating with color calibrated monitors using Adobe Creative Cloud - Adobe,"Thu, 12 Nov 2020 08:00:00 GMT"
1,Adobe acquires marketing workflow startup Workfront for $1.5B - TechCrunch,"Mon, 09 Nov 2020 08:00:00 GMT"
2,"Adobe Flash Player Reaches End of Life on December 31, 2020 - Qualys","Mon, 21 Dec 2020 08:00:00 GMT"
3,Adobe Acquires Workfront For $1.5 Billion - Forbes,"Tue, 10 Nov 2020 08:00:00 GMT"
4,"Adobe North Tower Rises at 333 West San Fernando Street, Downtown San Jose - San Francisco YIMBY","Mon, 28 Dec 2020 08:00:00 GMT"
5,Sustainable lateral strengthening of traditional adobe walls using natural reinforcements - ScienceDirect.com,"Tue, 10 Nov 2020 08:00:00 GMT"
6,AI Sky Replacement – Adobe Photoshop 2021 vs Skylum Luminar 4 - SLR Lounge,"Wed, 11 Nov 2020 08:00:00 GMT"
7,Adobe Flash Player is finally laid to rest - BBC,"Thu, 31 Dec 2020 08:00:00 GMT"
8,15 mind-blowing stats about user experience design - Adobe,"Thu, 17 Dec 2020 08:00:00 GMT"
9,Adobe MAX 2020 - by the numbers - Adobe,"Mon, 02 Nov 2020 08:00:00 GMT"
10,Painting the reflections of Black women - Adobe,"Thu, 10 Dec 2020 08:00:00 GMT"
11,Coming together as a family with our Adobe parents - Adobe,"Wed, 02 Dec 2020 08:00:00 GMT"
12,"Pivoting, responding and moving ahead: Five diversity and inclusion lessons from 2020 - Adobe","Wed, 23 Dec 2020 08:00:00 GMT"
13,Maximize your productivity on-the-go with Adobe Acrobat - Adobe,"Wed, 16 Dec 2020 08:00:00 GMT"
14,How NIH built the mobile PathogenAR app with the help of Adobe XD - Adobe,"Mon, 23 Nov 2020 08:00:00 GMT"
15,3D & AR watchlist: 8 fan favorites from Adobe MAX 2020 - Adobe,"Tue, 01 Dec 2020 08:00:00 GMT"
16,"How Amber Torrealba is making a splash, in and out of the water - Adobe","Thu, 17 Dec 2020 08:00:00 GMT"
17,A culture of learning at Adobe - Adobe,"Tue, 15 Dec 2020 08:00:00 GMT"
18,How Roger Brooks went from theoretical physics to digital experiences - Adobe,"Tue, 08 Dec 2020 08:00:00 GMT"
19,Find inspiration in the colors of nature bathing - Adobe,"Thu, 19 Nov 2020 08:00:00 GMT"
20,Adobe to Strengthen Its Cloud Segment With $1.5B Workfront Acquisition - CFO.com,"Tue, 10 Nov 2020 08:00:00 GMT"
21,Common Controls Framework (CCF) by Adobe v4.0 Now Available - Adobe,"Thu, 19 Nov 2020 08:00:00 GMT"
22,How IndiGo is getting closer to customers through a digital-first strategy - Adobe,"Fri, 04 Dec 2020 08:00:00 GMT"
23,"Adobe Acquires Workfront, Focusing Squarely on the Work of Marketing and Customer Engagement - Constellation Research","Wed, 11 Nov 2020 08:00:00 GMT"
24,How AbbVie delivers exceptional patient experiences - Adobe,"Tue, 08 Dec 2020 08:00:00 GMT"
25,Adobe Quick Export in Premiere Pro & Media Replacement in Motion Graphics templates - Newsshooter,"Wed, 18 Nov 2020 08:00:00 GMT"
26,Museum officials concerned about planned sale of former San Pablo City Hall property - Richmond Standard,"Tue, 24 Nov 2020 08:00:00 GMT"
27,"In southwest Colorado, high tech plays in the mud to produce ecologically sound architecture - and art - The Colorado Sun","Fri, 13 Nov 2020 08:00:00 GMT"
28,Neon Glow-up: Adobe Stock’s bright new motion trend - Adobe,"Wed, 11 Nov 2020 08:00:00 GMT"
29,Recycle your PDF content with Acrobat online tools - Adobe,"Mon, 02 Nov 2020 08:00:00 GMT"
30,Adobe (ADBE) Perfectly Positioned for New Highs - Investopedia,"Tue, 08 Dec 2020 08:00:00 GMT"
31,"Adobe's Document Cloud gunning for DocuSign, digital workflows - ZDNET","Fri, 11 Dec 2020 08:00:00 GMT"
32,The University of New Mexico builds a bridge to the future as an Adobe Creative Campus - Adobe,"Thu, 12 Nov 2020 08:00:00 GMT"
33,"To Dust It Is Returning, But Historic Adobe Church May Soon Get A Second Life - Texas Standard","Mon, 28 Dec 2020 08:00:00 GMT"
34,"Waste-based natural fiber reinforcement of adobe mixtures: Physical, mechanical, damage and durability performance assessment - ScienceDirect.com","Tue, 10 Nov 2020 08:00:00 GMT"
35,Adobe Spark and Square come together to help small businesses go big this holiday season - Adobe,"Fri, 13 Nov 2020 08:00:00 GMT"
36,Adobe Officially Ends Support of Its Era-Defining Flash Player Today - Wccftech,"Thu, 31 Dec 2020 08:00:00 GMT"
37,Consumers expect brands to be inclusive - eMarketer,"Wed, 25 Nov 2020 08:00:00 GMT"
38,Don’t assume you know someone’s story - Adobe,"Tue, 10 Nov 2020 08:00:00 GMT"
39,Adobe Design on Mission St | An Eclectic Shop in South Pasadena - South Pasadena News,"Thu, 03 Dec 2020 08:00:00 GMT"
40,"Goodbye, Adobe Flash: What Educators Need to Know - Education Week","Mon, 21 Dec 2020 08:00:00 GMT"
41,"Now in Beta: Premiere Pro, Premiere Rush, and Audition for Apple M1 Systems - Adobe","Mon, 21 Dec 2020 08:00:00 GMT"
42,Adobe Flash rides off into the sunset - The Verge,"Thu, 31 Dec 2020 08:00:00 GMT"
43,"Adobe Releases Lightroom for Apple M1 and Windows Arm, Adds Apple ProRAW Support - PetaPixel","Tue, 08 Dec 2020 08:00:00 GMT"
44,Experimental investigation on axially loaded adobe masonry columns confined by polymeric straps - ScienceDirect.com,"Mon, 30 Nov 2020 08:00:00 GMT"
45,Adobe Photoshop and Lightroom 2021: New Features - Rangefinder Magazine,"Fri, 04 Dec 2020 08:00:00 GMT"
46,Adobe’s virtual summer internship program: fostering brilliant ideas from a distance - Adobe,"Mon, 09 Nov 2020 08:00:00 GMT"
47,Adobe Cafe remains a staple of the New Braunfels dining scene - Community Impact,"Thu, 05 Nov 2020 08:00:00 GMT"
48,Adobe Flash Player is officially dead tomorrow - BleepingComputer,"Thu, 31 Dec 2020 08:00:00 GMT"
49,How to Download Adobe Flash Player on a Mac - MakeUseOf,"Thu, 12 Nov 2020 08:00:00 GMT"
50,Is Adobe Flash Player No Longer Supported? - Snopes.com,"Thu, 03 Dec 2020 08:00:00 GMT"
51,Adobe Photoshop for Windows 10 on ARM finally arrives in beta - Windows Central,"Tue, 17 Nov 2020 08:00:00 GMT"
52,Adobe’s ‘When I See Black’ Brings New Black Perspectives ... - Complex,"Tue, 24 Nov 2020 08:00:00 GMT"
53,Adobe users targeted in dangerous new phishing campaign - TechRadar,"Fri, 04 Dec 2020 08:00:00 GMT"
54,"Adobe fixes critical security vulnerabilities in Acrobat, Reader - BleepingComputer","Tue, 03 Nov 2020 08:00:00 GMT"
55,"You Can Now Remix Marshmello's Helmet for a Chance to Win $10,000 - EDM.com","Tue, 10 Nov 2020 08:00:00 GMT"
56,"Adobe acquires Workfront, makes $1.5bn bet on work management - or does it? - Diginomica","Tue, 10 Nov 2020 08:00:00 GMT"
57,Must-see historical site in Milpitas: José Maria de Jesus Alviso Adobe and Rancho Milpitas - The Milpitas Beat,"Wed, 18 Nov 2020 08:00:00 GMT"
58,Modern Gothic design explores and empowers with futuristic noir - Adobe,"Fri, 04 Dec 2020 08:00:00 GMT"
59,"72andSunny, Somesuch Director Vincent Haycock Team On ""Special Delivery"" For Adobe - SHOOTonline","Thu, 26 Nov 2020 08:00:00 GMT"
60,Adobe just released the last Flash update ever - The Verge,"Wed, 09 Dec 2020 08:00:00 GMT"
61,"The Briefing: Adobe Buys Workfront for $1.5B, TIER Lands $250M, Hopin Raises $125M, And More - Crunchbase News","Tue, 10 Nov 2020 08:00:00 GMT"
62,Adobe Flash is going away for real this month - The Next Web,"Thu, 10 Dec 2020 08:00:00 GMT"
63,Adobe Liquid Mode is ideal for PDF files on small devices - Good e-Reader,"Sat, 07 Nov 2020 08:00:00 GMT"
64,Delving Into Dimension: A Photo Pro Riffs on His Experiences With Adobe’s Powerful New 3D Tool - PRINT Magazine,"Thu, 17 Dec 2020 08:00:00 GMT"
65,"Black Friday online shopping on track to hit record as holiday shoppers skip stores, Adobe says - CNBC","Fri, 27 Nov 2020 08:00:00 GMT"
66,Excalibur adds more speed and less mouse to Adobe Premiere Pro by Scott Simmons - ProVideo Coalition - ProVideo Coalition,"Wed, 09 Dec 2020 08:00:00 GMT"
67,Adobe buys Workfront for $1.5 billion - - Enterprise Times,"Tue, 10 Nov 2020 08:00:00 GMT"
68,"Adobe to Support Photoshop, Lightroom, and Lightroom CC Natively on Apple Silicon - Fstoppers","Thu, 12 Nov 2020 08:00:00 GMT"
69,"Adobe brings over 20,000 design assets to Spark - TechCrunch","Thu, 17 Dec 2020 08:00:00 GMT"
70,iPhone Adobe Fresco Review: A Pocket-Sized Drawing Experience - iMore,"Fri, 06 Nov 2020 08:00:00 GMT"
71,Adobe Premiere Rush vs. Adobe Premiere Pro: Which Should You Use? - MakeUseOf,"Fri, 04 Dec 2020 08:00:00 GMT"
72,"Goodbye to Flash - if you're still running it, uninstall Flash Player now - Tripwire","Thu, 10 Dec 2020 08:00:00 GMT"
73,"Adobe Flash is about to die, but classic Flash games will live on - Fast Company","Tue, 29 Dec 2020 08:00:00 GMT"
74,5 Ways to Keep Projects Organized in Adobe Premiere Pro - MakeUseOf,"Mon, 09 Nov 2020 08:00:00 GMT"
75,Adobe Lightroom now supports Apple’s M1 chips and ARM on Windows 10 - The Next Web,"Tue, 08 Dec 2020 08:00:00 GMT"
76,Adobe displays Flash Player end of life popup on Windows devices - gHacks Technology News,"Wed, 30 Dec 2020 08:00:00 GMT"
77,"Waste-based natural fiber reinforcement of adobe mixtures: Physical, mechanical, damage and durability performance assessment - ScienceDirect.com","Tue, 10 Nov 2020 08:00:00 GMT"
78,"In its death throes, Adobe’s Flash kills off Zynga’s original FarmVille - VentureBeat","Thu, 31 Dec 2020 08:00:00 GMT"
79,Retailer Perspective: Adobe Interiors - Cowboys and Indians Magazine,"Wed, 18 Nov 2020 08:00:00 GMT"
80,A new chapter for Pantone’s color of the year in 2021 - Adobe,"Thu, 10 Dec 2020 08:00:00 GMT"
81,Adobe Lightroom is now available on the Mac App Store with native M1 support - AppleInsider,"Tue, 08 Dec 2020 08:00:00 GMT"
82,Adobe Apps Not Officially Supported on Apple Silicon Running Rosetta 2 - PetaPixel,"Fri, 13 Nov 2020 08:00:00 GMT"
83,The End of an Era: Adobe Flash Player Support Ends Today - MakeUseOf,"Thu, 31 Dec 2020 08:00:00 GMT"
84,"An ode to Adobe Flash, and how it saved my future - Windows Central","Thu, 31 Dec 2020 08:00:00 GMT"
85,Cyber Monday was biggest online shopping day in U.S. history - CBS News,"Tue, 01 Dec 2020 08:00:00 GMT"
86,Flash Shut Down Will Cripple Millions Of Websites On January 12 - Forbes,"Thu, 10 Dec 2020 08:00:00 GMT"
87,"Adobe to block Flash content from running on January 12, 2021 - ZDNET","Wed, 09 Dec 2020 08:00:00 GMT"
88,The final Adobe Flash Player update has been released - gHacks Technology News,"Wed, 09 Dec 2020 08:00:00 GMT"
89,Adobe releases Premiere Pro beta for M1 Macs - Engadget,"Mon, 21 Dec 2020 08:00:00 GMT"
90,How to Use the Adobe InDesign Story Editor - MakeUseOf,"Tue, 01 Dec 2020 08:00:00 GMT"
91,"Adobe Flash is finally gone—and with it, the weird spontaneity of the early 2000s Internet - Prospect Magazine","Wed, 30 Dec 2020 08:00:00 GMT"
92,Adobe Lightroom gets native support for Windows 10 on ARM PCs and Apple Silicon Macs - Windows Report,"Tue, 08 Dec 2020 08:00:00 GMT"
93,Adobe Fresco Makes Painting on the iPhone Way Easy - Lifewire,"Tue, 08 Dec 2020 08:00:00 GMT"
94,"Casa Ortiz gallery in Socorro draws art lovers, may attract heritage tourists, adobe fans - El Paso Times","Wed, 30 Dec 2020 15:44:27 GMT"
95,Adobe to Pull the Plug on Flash Games in 2021 - MakeUseOf,"Thu, 10 Dec 2020 08:00:00 GMT"
96,How to Use Adobe Camera Raw as a Smart Object in Photoshop - MakeUseOf,"Thu, 10 Dec 2020 08:00:00 GMT"
97,"Adobe releases final Flash Player update, warns of 2021 kill switch - BleepingComputer","Sat, 12 Dec 2020 08:00:00 GMT"
98,Adobe releases Arm beta version of Photoshop for Windows and macOS - The Verge,"Tue, 17 Nov 2020 08:00:00 GMT"
99,Use Adobe Sensei to Easily Colorize Black and White Photos in Photoshop CC - Fstoppers,"Wed, 23 Dec 2020 08:00:00 GMT"
