,Title,Date
0,Adobe and Microsoft Bring Industry-Leading Acrobat PDF Experience to Microsoft Edge - Adobe,"Wed, 08 Feb 2023 08:00:00 GMT"
1,National Women's Soccer League Welcomes Adobe as Official Creativity Partner - NWSL,"Tue, 31 Jan 2023 08:00:00 GMT"
2,"Reminder: Adobe SSO accounts end February 14, 2023 - Drake University Newsroom","Tue, 31 Jan 2023 08:00:00 GMT"
3,Adobe’s Future Workforce Study Reveals What the Next Generation Workforce Is Looking for in the Workplace - Adobe,"Tue, 24 Jan 2023 08:00:00 GMT"
4,Adobe Lightroom Brings Professional Photo Editing to Samsung Galaxy S23 Series - Adobe Newsroom,"Wed, 01 Feb 2023 08:00:00 GMT"
5,Academy Award recognizes Substance 3D for transforming movie visual effects and animation - Adobe,"Fri, 24 Feb 2023 08:00:00 GMT"
6,Media Alert: Leading Retail and Fashion Brands Embrace Adobe Substance 3D Solutions - Adobe Newsroom,"Thu, 19 Jan 2023 08:00:00 GMT"
7,Adobe again named one of the world’s most admired companies - Adobe,"Wed, 01 Feb 2023 08:00:00 GMT"
8,Breaking the conventional blueprint of design - Adobe,"Tue, 07 Feb 2023 08:00:00 GMT"
9,Celebrating 16 Years of Marketing Transformation with Adobe CMO Ann Lewnes - Adobe,"Tue, 17 Jan 2023 08:00:00 GMT"
10,Sony Pictures’ Missing uses Adobe Creative Cloud to bring a riveting computer-screen thriller to life - Adobe,"Thu, 02 Feb 2023 08:00:00 GMT"
11,Petco selects Adobe Experience Cloud to fuel growth as a one-stop destination for pet parents - Adobe,"Tue, 28 Feb 2023 08:00:00 GMT"
12,Safer digital experiences start with smarter testing - Adobe,"Wed, 15 Feb 2023 08:00:00 GMT"
13,Adobe is again named a most JUST company - Adobe,"Tue, 10 Jan 2023 08:00:00 GMT"
14,A Roadmap for Successful Pro Bono Partnerships That Make a Difference - Adobe,"Tue, 24 Jan 2023 08:00:00 GMT"
15,What It Means to Belong - Adobe,"Tue, 28 Feb 2023 08:00:00 GMT"
16,"New year, new you — make Adobe Express a part of your resolutions - Adobe","Mon, 09 Jan 2023 08:00:00 GMT"
17,Embracing Creativity and Digital Literacy with Adobe Express in New Mexico’s Public Schools - Adobe,"Wed, 18 Jan 2023 08:00:00 GMT"
18,WHOlives teams up with students at The University of Utah and Adobe to promote clean water around the world - Adobe,"Tue, 21 Feb 2023 08:00:00 GMT"
19,"The stories of filmmakers, creators, dreamers and beyond bring us together at the 2023 Sundance Film Festival - Adobe","Tue, 17 Jan 2023 08:00:00 GMT"
20,How The Leadership Circles Program At Adobe Helps Grow Female Leaders - Forbes,"Tue, 10 Jan 2023 08:00:00 GMT"
21,Zolaz debuts new cloud gaming service built on Adobe Experience Manager - Adobe,"Tue, 24 Jan 2023 08:00:00 GMT"
22,Celebrating pioneers on and off the field as the Official Creativity Partner of the National Women’s Soccer League - Adobe,"Tue, 31 Jan 2023 08:00:00 GMT"
23,5 ways Photoshop can help you create anything you can imagine - Adobe,"Tue, 03 Jan 2023 08:00:00 GMT"
24,Is Adobe using your photos to train its AI? It’s complicated - TechCrunch,"Fri, 06 Jan 2023 08:00:00 GMT"
25,VFX Studio Perception uses Premiere Pro and After Effects to create Marvel’s Black Panther: Wakanda Forever title sequences - Adobe,"Tue, 28 Feb 2023 08:00:00 GMT"
26,"With 84% ownership of the shares, Adobe Inc. (NASDAQ:ADBE) is heavily dominated by institutional owners - Yahoo Finance","Mon, 30 Jan 2023 08:00:00 GMT"
27,Qualcomm Selects Adobe To Deepen Customer Relationships With Real-Time Personalization - Adobe Newsroom,"Thu, 23 Feb 2023 08:00:00 GMT"
28,Pitching Hour: Big Opportunities for Small Businesses - Adobe,"Wed, 15 Feb 2023 08:00:00 GMT"
29,Showcasing Student Creativity and Visual Storytelling with the Adobe Digital Edge Awards - Adobe,"Mon, 13 Feb 2023 08:00:00 GMT"
30,DOJ Expected to Block Adobe's $20 Billion Figma Acquisition - PCMag,"Fri, 24 Feb 2023 08:00:00 GMT"
31,Printing and embellishing: Get the 'wow’ factor - Adobe,"Thu, 16 Feb 2023 08:00:00 GMT"
32,Why Should Businesses Password Protect Their Documents? - Adobe,"Tue, 14 Feb 2023 08:00:00 GMT"
33,US DOJ Preps Antitrust Suit to Block Adobe’s $20 Billion Figma Deal - Bloomberg.com,"Thu, 23 Feb 2023 08:00:00 GMT"
34,Adobe Is Using Your Data to Train AI: How to Turn It Off - How-To Geek,"Wed, 04 Jan 2023 08:00:00 GMT"
35,Adobe Lightroom Desktop Review - The Phoblographer,"Tue, 24 Jan 2023 08:00:00 GMT"
36,Artists accuse Adobe of tracking their design process to power its AI - Fast Company,"Fri, 06 Jan 2023 08:00:00 GMT"
37,Qualcomm selects Adobe to deepen customer relationships with real-time personalization - Adobe,"Thu, 23 Feb 2023 08:00:00 GMT"
38,Why you should turn off Content Analysis in Adobe Creative Cloud (and how to do it) - iMore,"Fri, 13 Jan 2023 08:00:00 GMT"
39,Amazon and Adobe among brands influencers like working with most - Ad Age,"Tue, 03 Jan 2023 08:00:00 GMT"
40,Former Adobe CTO Raises $65 Million To Help Businesses Generate Marketing Content With AI - Forbes,"Mon, 27 Feb 2023 08:00:00 GMT"
41,Microsoft Edge is getting Adobe’s freemium PDF viewer - The Verge,"Wed, 08 Feb 2023 08:00:00 GMT"
42,The Hawaii State Public Library System builds a bridge to digital literacy - Adobe,"Wed, 22 Feb 2023 08:00:00 GMT"
43,How Digital Document Collaboration Helps School Admins Stay Organized - Adobe,"Thu, 16 Feb 2023 08:00:00 GMT"
44,LiveRamp and Adobe Real-Time Customer Data Platform enhance insights and activation with RampID - Business Wire,"Wed, 01 Mar 2023 08:00:00 GMT"
45,Adobe May Be Using Your Photos to Train its AI - PetaPixel,"Thu, 05 Jan 2023 08:00:00 GMT"
46,Petco Adopts Adobe For AI-Powered Personalized Marketing - Forbes,"Tue, 28 Feb 2023 08:00:00 GMT"
47,The 2023 Core77 Design Awards Are Open For Entry - Adobe,"Wed, 18 Jan 2023 08:00:00 GMT"
48,Microsoft Edge’s simple PDF reader is being replaced by Adobe Acrobat - PCWorld,"Wed, 08 Feb 2023 08:00:00 GMT"
49,Adobe to open Atlanta office as company embraces hybrid work - The Business Journals,"Thu, 26 Jan 2023 08:00:00 GMT"
50,"Adobe says no, it’s not using your images to train AI art generators - The Verge","Wed, 18 Jan 2023 08:00:00 GMT"
51,Top tips for making the most of Adobe Summit - Adobe,"Wed, 22 Feb 2023 08:00:00 GMT"
52,See you in Vegas — Adobe Summit 2023 registration is open - Adobe,"Wed, 01 Feb 2023 08:00:00 GMT"
53,Adobe Vice President Has Used A Leadership Mosaic For Years - Maybe You Should Too - Forbes,"Wed, 18 Jan 2023 08:00:00 GMT"
54,How Adobe’s Scott Belsky balances engineering and art (Cornell Tech @ Bloomberg) - Bloomberg.com,"Thu, 02 Feb 2023 08:00:00 GMT"
55,Kevin Hart Walks Out to Canon Song at Adobe Max Creativity Conference - Rapzilla,"Mon, 02 Jan 2023 08:00:00 GMT"
56,Software Wars: Can Capture One Pro Defeat Lightroom Classic? - Fstoppers,"Sat, 07 Jan 2023 08:00:00 GMT"
57,Adobe will use your work to train its AI algorithms unless you opt out - theregister.com,"Sat, 07 Jan 2023 08:00:00 GMT"
58,Adobe Acrobat DC review - TechRadar,"Tue, 17 Jan 2023 08:00:00 GMT"
59,Scientific and Technical Academy Honors Adobe Substance Designers - Variety,"Mon, 27 Feb 2023 08:00:00 GMT"
60,Adobe Spark review - TechRadar,"Thu, 05 Jan 2023 08:00:00 GMT"
61,Is Adobe Using Your Files to Train Its AI? How to Opt Out if So - MakeUseOf,"Thu, 02 Feb 2023 08:00:00 GMT"
62,Download Acrobat DC: How to try Adobe Acrobat for free or with Creative Cloud - TechRadar,"Mon, 30 Jan 2023 08:00:00 GMT"
63,Gen Zers won't even apply to a job if the salary isn't listed - Business Insider,"Tue, 24 Jan 2023 08:00:00 GMT"
64,Adobe Photoshop - Review 2023 - PCMag Middle East,"Thu, 23 Feb 2023 08:00:00 GMT"
65,"New owner of Yachats' largest motel has big plans for upgrades and creating more rooms, shops and housing - Lincoln Chronicle","Thu, 26 Jan 2023 08:00:00 GMT"
66,Adobe is almost definitely using your content to train AI - TechRadar,"Mon, 09 Jan 2023 08:00:00 GMT"
67,NWSL Looks Ahead From Controversy With Multiyear Adobe Deal - Sportico.com,"Tue, 31 Jan 2023 08:00:00 GMT"
68,"Scotch Oakburn College innovates, educates and creates the future with Adobe - Adobe","Wed, 15 Feb 2023 08:00:00 GMT"
69,"Professional surfer, content creator and advocate Liv Stone, on the power of community to demystify disabilities - Adobe","Tue, 28 Feb 2023 08:00:00 GMT"
70,How to Edit Vertical Short-Form Videos With Adobe Premiere Rush - MakeUseOf,"Wed, 25 Jan 2023 08:00:00 GMT"
71,20-year-old Hill Country Tex-Mex spot revived under new ownership - MySA,"Fri, 06 Jan 2023 08:00:00 GMT"
72,"No, you don't need a new mic — use this AI hack instead from Adobe Podcast - Windows Central","Sat, 04 Feb 2023 08:00:00 GMT"
73,"9 tech predictions for 2023 from seed investor in Uber, Pinterest, and other top companies - Business Insider","Tue, 03 Jan 2023 08:00:00 GMT"
74,"Leaders who want longevity in their role need to love what they do and 'have other passions,' Adobe CEO says - Business Insider","Mon, 09 Jan 2023 08:00:00 GMT"
75,"‘Tulsa King’ Recap: Season 1, Episode 8 “Adobe Walls” - Nerds and Beyond","Sun, 01 Jan 2023 08:00:00 GMT"
76,Adobe Lightroom brings professional photo editing to Samsung Galaxy S23 series - Fast Company,"Tue, 07 Feb 2023 08:00:00 GMT"
77,Microsoft looked at buying Figma but declined to put in an offer as Adobe deal was nearing - CNBC,"Wed, 11 Jan 2023 08:00:00 GMT"
78,"Microsoft and Google back Typeface, an enterprise generative AI startup led by ex-Adobe CTO - GeekWire","Tue, 28 Feb 2023 08:00:00 GMT"
79,Adobe Acrobat makes reading PDFs even better in Microsoft Edge - xda-developers.com,"Wed, 08 Feb 2023 08:00:00 GMT"
80,"Biggio Center to host New Faculty Orientation, EASL Academy and Adobe workshops - Auburn University","Tue, 03 Jan 2023 08:00:00 GMT"
81,House Votes to Pass CLARITY Act After Drama Threatened to Derail Crypto Market Structure Bill - PYMNTS.com,"Sun, 26 Feb 2023 08:00:00 GMT"
82,Tutorial: Creating Materials With Substance 3D Sampler & Adobe Capture - 80 Level,"Wed, 22 Feb 2023 08:00:00 GMT"
83,Adobe and Microsoft Bring Industry-Leading Acrobat PDF Experience to 1.4 Billion Windows Users Through Microsoft Edge - Business Wire,"Wed, 08 Feb 2023 08:00:00 GMT"
84,Buro Happold Orchestrates the Future of Communities with Creative and Sustainable Solutions - Adobe,"Mon, 23 Jan 2023 08:00:00 GMT"
85,The Creators’ Cloud is Sony’s Answer to Adobe Frame.io Camera to Cloud - PetaPixel,"Wed, 22 Feb 2023 08:00:00 GMT"
86,EU accepts referral request to review Adobe/Figma - Global Competition Review,"Thu, 16 Feb 2023 08:00:00 GMT"
87,Turn to tech: How the digital age could help save the environment - Adobe,"Mon, 06 Feb 2023 08:00:00 GMT"
88,Adobe Animate review - TechRadar,"Tue, 10 Jan 2023 08:00:00 GMT"
89,The Nike SB Dunk Low “Adobe” Isn’t What You Think - WeRSM,"Fri, 17 Feb 2023 08:00:00 GMT"
90,Cal Earth Institute - Urth Magazine,"Mon, 27 Feb 2023 08:00:00 GMT"
91,Adobe Character Animator Starter free animation software review - TechRadar,"Tue, 17 Jan 2023 08:00:00 GMT"
92,How to Create a Watermark in Lightroom (Updated) - SLR Lounge,"Mon, 09 Jan 2023 08:00:00 GMT"
93,Adobe Substance 3D: Engaging With a New Generation of Designers and Modelers - 80 Level,"Mon, 13 Feb 2023 08:00:00 GMT"
94,Samsung Galaxy S23 Photos Need Adobe Lightroom for the Best Results - PCMag,"Thu, 02 Feb 2023 08:00:00 GMT"
95,Adobe: We’re Not Training Generative AI on User Content - AI Business,"Thu, 19 Jan 2023 08:00:00 GMT"
96,AMD Ryzen 7000 vs. Intel 13th-gen Core Workstation Performance Review - Techgage,"Wed, 01 Mar 2023 08:00:00 GMT"
97,Adobe ships Photoshop 24.2 - CG Channel,"Tue, 28 Feb 2023 08:00:00 GMT"
98,Microsoft switches Edge’s PDF reader to pay-to-play Adobe Acrobat - theregister.com,"Fri, 10 Feb 2023 08:00:00 GMT"
99,Gruene Tex-Mex spot is back in business under new owners - MySA,"Sat, 18 Feb 2023 08:00:00 GMT"
