,Title,Date
0,NSA Recommends Adobe Acrobat Reader Security Configurations - National Security Agency (NSA) (.gov),"Thu, 20 Jan 2022 08:00:00 GMT"
1,Adobe: U.S. consumers spent a record $204 billion online this holiday season - Adobe,"Wed, 12 Jan 2022 08:00:00 GMT"
2,What is Adobe? - Tech Monitor,"Tue, 22 Feb 2022 08:00:00 GMT"
3,Adobe Premiere User Tries Final Cut Pro... And Likes It - Fstoppers,"Thu, 10 Feb 2022 08:00:00 GMT"
4,"Adobe's Brian Miller Talks Diversity, Leadership – And The Importance Of Talent Development - Forbes","Thu, 03 Feb 2022 08:00:00 GMT"
5,Adobe announces readability consortium with Google and UCF to improve reading for all - Adobe,"Tue, 15 Feb 2022 08:00:00 GMT"
6,Introducing the Adobe Equity and Advancement Initiative - Adobe,"Tue, 22 Feb 2022 08:00:00 GMT"
7,Adobe Completes Acquisition of Abstract Notebooks - Adobe,"Mon, 10 Jan 2022 08:00:00 GMT"
8,Josh and Erica share a day in the life of an Adobe BDR—and where they plan to go next - Adobe,"Thu, 24 Feb 2022 08:00:00 GMT"
9,Adobe’s 2021 Founders’ Award recipients share their proudest career moments - Adobe,"Wed, 09 Feb 2022 08:00:00 GMT"
10,New in Premiere Pro: Remix for music and 3x faster Speech to Text - Adobe,"Tue, 08 Feb 2022 08:00:00 GMT"
11,C2PA releases version 1.0 of world's first industry standard for content authenticity - Adobe,"Wed, 26 Jan 2022 08:00:00 GMT"
12,Cosmin Ionita on starting at Adobe as a grad student and staying for the tech challenges - Adobe,"Tue, 11 Jan 2022 08:00:00 GMT"
13,"Supporting, celebrating and championing all women and their stories - Adobe","Mon, 24 Jan 2022 08:00:00 GMT"
14,Adobe named a Best Workplace in Japan for a sixth consecutive year - Adobe,"Tue, 15 Feb 2022 08:00:00 GMT"
15,Media Alert: Adobe Digital Price Index: Online Inflation Hits Another High in December - Adobe Newsroom,"Wed, 12 Jan 2022 08:00:00 GMT"
16,20 years of transparency in PDF - Adobe,"Mon, 31 Jan 2022 08:00:00 GMT"
17,Celebrating and empowering everyone with a story to tell at the 2022 Sundance Film Festival - Adobe,"Wed, 19 Jan 2022 08:00:00 GMT"
18,Adobe is one of the World’s Most Admired Companies - Adobe,"Wed, 02 Feb 2022 08:00:00 GMT"
19,Adobe Creative Cloud Gives Students an Edge in the Classroom and Beyond - EdTech Magazine,"Thu, 27 Jan 2022 08:00:00 GMT"
20,Make creative work easier with Adobe Acrobat - Adobe,"Thu, 20 Jan 2022 08:00:00 GMT"
21,It’s Official – Adobe UK is a Best Workplace for Wellbeing - Adobe,"Thu, 17 Feb 2022 08:00:00 GMT"
22,Adobe named a Leader for fifth consecutive year in 2022 Gartner® Magic Quadrant™ for Digital Experience Platforms - Adobe,"Mon, 28 Feb 2022 08:00:00 GMT"
23,"Download Adobe Sign: Get a free trial, or buy a subscription - Creative Bloq","Tue, 18 Jan 2022 08:00:00 GMT"
24,How Cru Brought its Global Marketing Under a Single Umbrella - Adobe,"Mon, 24 Jan 2022 08:00:00 GMT"
25,East Carolina University encourages creativity for all with Adobe Creative Cloud - Adobe,"Thu, 24 Feb 2022 08:00:00 GMT"
26,"Developing my career with Adobe, one role at a time - Adobe","Fri, 21 Jan 2022 08:00:00 GMT"
27,Adobe Acrobat Standard DC vs. Adobe Acrobat Pro DC - PCWorld,"Tue, 22 Feb 2022 08:00:00 GMT"
28,Nothing Bundt Cakes Creates a Recipe for Customer Joy with Adobe Commerce - Adobe,"Mon, 14 Feb 2022 08:00:00 GMT"
29,Packing a Punch with The Suicide Squad Titles - Adobe,"Fri, 14 Jan 2022 08:00:00 GMT"
30,Adobe and Pantone to Part Ways; What You Gonna Do? - WhatTheyThink,"Thu, 24 Feb 2022 08:00:00 GMT"
31,Adobe Sign vs HelloSign: Which is optimal for your business in 2023? - PandaDoc,"Mon, 31 Jan 2022 08:00:00 GMT"
32,How diversity and innovation play a role at Adobe - Adobe,"Mon, 28 Feb 2022 08:00:00 GMT"
33,How to Design a Concept Store with Substance 3D - Adobe,"Tue, 01 Feb 2022 08:00:00 GMT"
34,"If you use these Adobe apps, you may be under ‘high’ risk - Times of India","Mon, 14 Feb 2022 08:00:00 GMT"
35,How IIT Madras brings efficiency and accessibility to academics with Adobe Acrobat - Adobe,"Thu, 13 Jan 2022 08:00:00 GMT"
36,"Tech Reviews: Adobe Substance 3D Painter & Premiere, Isotropix Clarisse iFX 5 - Animation Magazine","Sun, 16 Jan 2022 08:00:00 GMT"
37,Creatives aren’t happy with Adobe and Billie Eilish’s latest collaboration - Creative Bloq,"Fri, 28 Jan 2022 08:00:00 GMT"
38,Adobe XD Review - PCMag,"Tue, 01 Feb 2022 08:00:00 GMT"
39,The Power of Storytelling: Three Takeaways from My Fireside Chat with Journalist Jon Fortt - Adobe,"Mon, 28 Feb 2022 08:00:00 GMT"
40,Adobe employees across the globe #SpringintoFearless for the Year of the Tiger - Adobe,"Tue, 25 Jan 2022 08:00:00 GMT"
41,"From a family of puppet makers, Meeb becomes part of the Character Animator family - Adobe","Wed, 26 Jan 2022 08:00:00 GMT"
42,Genpact Acquires Hoodoo Digital to Enhance its Adobe Capabilities - solutionsreview.com,"Wed, 05 Jan 2022 08:00:00 GMT"
43,Adobe Named a Leader in the 2022 Forrester Wave: Digital Asset Management - Adobe,"Wed, 16 Feb 2022 08:00:00 GMT"
44,Malicious hackers exploit Adobe to harvest credentials - Cybernews,"Thu, 13 Jan 2022 08:00:00 GMT"
45,How to Change the Highlight Color in Adobe Acrobat Reader - How-To Geek,"Mon, 10 Jan 2022 08:00:00 GMT"
46,Hackers are exploiting Adobe Creative Cloud to harvest user credentials - TechRadar,"Thu, 13 Jan 2022 08:00:00 GMT"
47,ESS and Gloucestershire College foster better enrolment experiences with Adobe Acrobat Sign - Adobe,"Wed, 16 Feb 2022 08:00:00 GMT"
48,Chinati Foundation launches adobe apprenticeship program - The Big Bend Sentinel,"Wed, 09 Feb 2022 08:00:00 GMT"
49,How Adobe Uses Data To Tell Better Stories - Forbes,"Fri, 21 Jan 2022 08:00:00 GMT"
50,How UX Design Fuels Space Exploration at NASA & SpaceX - Adobe,"Thu, 20 Jan 2022 08:00:00 GMT"
51,Film vs digital: does it make a difference? - Adobe,"Wed, 12 Jan 2022 08:00:00 GMT"
52,Valpak gains productivity and flexibility by transforming contracts with Adobe Acrobat Sign integrated with Salesforce - Adobe,"Thu, 20 Jan 2022 08:00:00 GMT"
53,Announcing the Recipients of the 2022 Sundance Institute | Adobe Mentorship Awards - sundance.org,"Thu, 27 Jan 2022 08:00:00 GMT"
54,"Edit more with Adobe Creative Cloud—save up to 25% on access to Photoshop, InDesign and Lightroom - USA Today","Thu, 17 Feb 2022 08:00:00 GMT"
55,Adobe launches revealing video series by artists - Creative Bloq,"Thu, 17 Feb 2022 08:00:00 GMT"
56,How to get your film into the Sundance Film Festival - Adobe,"Mon, 24 Jan 2022 08:00:00 GMT"
57,Ryan Hudson-Peralta’s Story: Designing with a Disability - Adobe,"Wed, 19 Jan 2022 08:00:00 GMT"
58,"Creating futuristic UIs, HUDs, and languages for Netflix’s “The Mitchells vs. The Machines” with Adobe - ProVideo Coalition","Fri, 04 Feb 2022 08:00:00 GMT"
59,Adobe’s CFO says the tech company has ‘3 unicorn businesses’ - Fortune,"Fri, 25 Feb 2022 08:00:00 GMT"
60,Rightpoint Acquires Adobe Solutions Partner Hoodoo Digital - - ChannelE2E,"Fri, 07 Jan 2022 08:00:00 GMT"
61,(+) Car Design Dialogues North America: Innovation Showcase with Adobe - Car Design News,"Mon, 14 Feb 2022 08:00:00 GMT"
62,Four Apps that Can Help Accelerate Your School’s Digital Transformation - Adobe,"Mon, 24 Jan 2022 08:00:00 GMT"
63,Serif Affinity – a rival for Adobe Creative Cloud - AEC Magazine,"Mon, 07 Feb 2022 08:00:00 GMT"
64,Pantone Color Libraries Are Leaving the Adobe Apps - CreativePro Network,"Mon, 03 Jan 2022 14:13:04 GMT"
65,Amazon creates immersive shopping experiences using Substance 3D - Adobe,"Mon, 07 Feb 2022 08:00:00 GMT"
66,Gloria Chen Pushes for Greater Representation - The HR Digest,"Thu, 06 Jan 2022 08:00:00 GMT"
67,What It's Like to Work at Adobe: 5 Employee Stories - Business Insider,"Wed, 26 Jan 2022 08:00:00 GMT"
68,Adobe Stock: Strong Buy For This Software Leader (NASDAQ:ADBE) - Seeking Alpha,"Fri, 25 Feb 2022 08:00:00 GMT"
69,Mixing Earth & Water: Adobe Art and Architecture With Joanna Keane Lopez - Atlas Obscura,"Wed, 26 Jan 2022 18:56:05 GMT"
70,"New year, new Puppet Maker Styles - Adobe","Mon, 31 Jan 2022 08:00:00 GMT"
71,Adobe Premiere Pro vs. DaVinci Resolve: Which Is the Ultimate Video Editor? - MakeUseOf,"Mon, 10 Jan 2022 08:00:00 GMT"
72,"Nokia Shanghai Bell Philippines, Inc. speeds connections with customers using Adobe Acrobat Sign - Adobe","Tue, 22 Feb 2022 08:00:00 GMT"
73,The efficiency of ureolytic bacteria isolated from historical adobe structures in the production of bio-bricks - ScienceDirect.com,"Mon, 24 Jan 2022 08:00:00 GMT"
74,"Wiji Lacsamana’s whimsical world of Filipino beliefs, personal rituals, and heritage - Adobe","Tue, 25 Jan 2022 08:00:00 GMT"
75,Adobe Premiere Pro Version 22.2– new updates & features - Newsshooter,"Wed, 09 Feb 2022 08:00:00 GMT"
76,Adobe Premiere Pro now uses AI to fit music to your videos - Engadget,"Tue, 08 Feb 2022 08:00:00 GMT"
77,Adobe forced to patch its own failed security update - IT Pro,"Fri, 18 Feb 2022 08:00:00 GMT"
78,Longtime Grand Rapids Mexican Restaurant Closing One of its Locations - WGRD 97.9,"Wed, 09 Feb 2022 08:00:00 GMT"
79,Adobe Research Extends Disentangled GAN Face Editing - Unite.AI,"Wed, 16 Feb 2022 08:00:00 GMT"
80,Big change to come in the Pantone color libraries of Adobe software - printindustry.news,"Wed, 19 Jan 2022 08:00:00 GMT"
81,Secrets to Hollywood Editing Success Using Adobe Premiere Pro - No Film School,"Tue, 01 Mar 2022 08:00:00 GMT"
82,Adobe acquires Abstract Notebooks - GfxSpeak,"Thu, 13 Jan 2022 08:00:00 GMT"
83,Billie Eilish's New Contest With Adobe Draws Huge Backlash - Newsweek,"Thu, 27 Jan 2022 08:00:00 GMT"
84,"Lightroom Classic and CC Are Nearly Identical, So Why Two Programs? - PetaPixel","Fri, 21 Jan 2022 08:00:00 GMT"
85,Adobe's Video Editor Can Now Intelligently Remix and Shorten Music to Perfectly Fit the Length of a Clip - Gizmodo,"Wed, 09 Feb 2022 08:00:00 GMT"
86,Adobe launches video app Premiere Rush CC - Creative Bloq,"Thu, 17 Feb 2022 08:00:00 GMT"
87,Adobe Creative Cloud Express Logo Creator review - TechRadar,"Fri, 04 Feb 2022 08:00:00 GMT"
88,The Trick for Putting Text on a Circle in Illustrator - Lifewire,"Sun, 27 Feb 2022 08:00:00 GMT"
89,Adobe Premiere Pro getting new Remix feature for syncing audio and video - AppleInsider,"Tue, 08 Feb 2022 08:00:00 GMT"
90,Get Adobe Creative Cloud Photography for less - Creative Bloq,"Fri, 04 Feb 2022 08:00:00 GMT"
91,Subscriptions on Vanderbilt’s dime: Free things you can get with your “.edu” - The Vanderbilt Hustler,"Sun, 30 Jan 2022 08:00:00 GMT"
92,10 Photo Editing Basics to Master in Lightroom - Adorama,"Wed, 02 Feb 2022 08:00:00 GMT"
93,"Ejatu Shaw’s emotive and relatable photography tells stories of Black love, family and joy - It's Nice That","Tue, 01 Feb 2022 08:00:00 GMT"
94,How to play Flash games after Adobe 'killed' them forever in 2020 - Times of India,"Wed, 02 Feb 2022 08:00:00 GMT"
95,Adobe speeds up Premiere Pro editing workflow - Amateur Photographer,"Fri, 11 Feb 2022 08:00:00 GMT"
96,Which cameras work best with Adobe's Super Resolution mode? - TechRadar,"Sat, 12 Feb 2022 08:00:00 GMT"
97,Create a photo grid collage using Photoshop - Photofocus,"Tue, 18 Jan 2022 08:00:00 GMT"
98,2022’s Pantone Color of the Year is a brand-new hue for the metaverse age - Adobe,"Wed, 16 Feb 2022 08:00:00 GMT"
99,Adobe Premiere Pro 22.2 Boosts NVIDIA & Intel GPU Performance In HEVC 10-bit Encoding Big Time - Wccftech,"Wed, 09 Feb 2022 08:00:00 GMT"
